{
  "$schema": "../../schemas/device_manifest.schema.json",
  "architecture": {
    "audio_channels": {
      "input": 1,
      "output": 1
    },
    "end_roles": {
      "RX_far": "closed",
      "RX_near": "microphone",
      "TX_far": "closed",
      "TX_near": "speaker"
    },
    "main_tube": {
      "center_spacing": {
        "unit": "mm",
        "value": 20.0
      },
      "cross_sectional_area": {
        "unit": "mm^2",
        "value": 20.155043202071983
      },
      "inner_diameter": {
        "unit": "mm",
        "value": 5.0657870100038425
      },
      "lumen_shape": "round",
      "segment_acoustic_length": {
        "unit": "mm",
        "value": 200.0
      },
      "total_acoustic_length": {
        "unit": "mm",
        "value": 400.0
      }
    },
    "nodes": [
      {
        "id": "N1",
        "position": {
          "unit": "mm",
          "value": 50.0
        }
      },
      {
        "id": "N2",
        "position": {
          "unit": "mm",
          "value": 105.0
        }
      },
      {
        "id": "N3",
        "position": {
          "unit": "mm",
          "value": 165.0
        }
      },
      {
        "id": "N4",
        "position": {
          "unit": "mm",
          "value": 235.0
        }
      },
      {
        "id": "N5",
        "position": {
          "unit": "mm",
          "value": 310.0
        }
      },
      {
        "id": "N6",
        "position": {
          "unit": "mm",
          "value": 360.0
        }
      }
    ],
    "research_object": "single-speaker single-microphone reconfigurable internal acoustic graph network",
    "segments": [
      {
        "end": {
          "unit": "mm",
          "value": 200.0
        },
        "id": "TX_front",
        "start": {
          "unit": "mm",
          "value": 0.0
        },
        "tube": "TX"
      },
      {
        "end": {
          "unit": "mm",
          "value": 400.0
        },
        "id": "TX_rear",
        "start": {
          "unit": "mm",
          "value": 200.0
        },
        "tube": "TX"
      },
      {
        "end": {
          "unit": "mm",
          "value": 200.0
        },
        "id": "RX_front",
        "start": {
          "unit": "mm",
          "value": 0.0
        },
        "tube": "RX"
      },
      {
        "end": {
          "unit": "mm",
          "value": 400.0
        },
        "id": "RX_rear",
        "start": {
          "unit": "mm",
          "value": 200.0
        },
        "tube": "RX"
      }
    ]
  },
  "bill_of_materials": {
    "authoritative_source": "reports/BOM_calibrated_v1_3.csv",
    "quantities": {
      "ALV1_RX_front_0_200_round": 1,
      "ALV1_RX_rear_200_400_round": 1,
      "ALV1_RX_slider_joint": 1,
      "ALV1_RX_slider_standard": 2,
      "ALV1_TX_front_0_200_round": 1,
      "ALV1_TX_rear_200_400_round": 1,
      "ALV1_end_adapter_hose_barb": 2,
      "ALV1_end_cap_closed": 2,
      "ALV1_end_lock_clip": 6,
      "ALV1_joint_lock_clip": 4,
      "ALV1_module_block": 8,
      "ALV1_module_bridge_D2p8": 4,
      "ALV1_module_bridge_D3p2": 8,
      "ALV1_module_bridge_D4p0": 4,
      "ALV1_module_development_blank": 2,
      "ALV1_slider_lock_wedge_H": 0,
      "ALV1_slider_lock_wedge_L": 0,
      "ALV1_slider_lock_wedge_M": 4,
      "ALV1_support_joint_base": 1,
      "ALV1_support_standard_base": 2,
      "ALV1_tube_retainer_joint": 2,
      "ALV1_tube_retainer_standard": 4
    }
  },
  "boundary_conditions": {
    "BLK_interpretation": "closed_not_open",
    "formal_microphone_count": 1,
    "formal_speaker_count": 1,
    "unpopulated_node_requirement": "BLK_required"
  },
  "calibration": {
    "acoustic_hole_compensation": {
      "unit": "mm",
      "value": 0.15
    },
    "acoustic_hole_coupon_measurements": [
      {
        "measured_post_print_diameter": {
          "unit": "mm",
          "value": null
        },
        "target_diameter": {
          "unit": "mm",
          "value": 2.8
        }
      },
      {
        "measured_post_print_diameter": {
          "unit": "mm",
          "value": null
        },
        "target_diameter": {
          "unit": "mm",
          "value": 3.2
        }
      },
      {
        "measured_post_print_diameter": {
          "unit": "mm",
          "value": null
        },
        "target_diameter": {
          "unit": "mm",
          "value": 4.0
        }
      },
      {
        "measured_post_print_diameter": {
          "unit": "mm",
          "value": null
        },
        "target_diameter": {
          "unit": "mm",
          "value": 4.2
        }
      },
      {
        "measured_post_print_diameter": {
          "unit": "mm",
          "value": null
        },
        "target_diameter": {
          "unit": "mm",
          "value": 5.0
        }
      }
    ],
    "d4_bridge_min_tip_wall": {
      "unit": "mm",
      "value": 0.8840909090909093
    },
    "dry_seal_dimensions": {
      "calibration_interference_values_mm": [
        0.0,
        0.04,
        0.08,
        0.12
      ],
      "compensation": {
        "acoustic_hole_mm": 0.15,
        "dry_seal_plug_mm": 0.0,
        "dry_seal_socket_mm": 0.0,
        "surface_extra_stock_mm": 0.0
      },
      "end": {
        "actual_cad_entry_interference_mm": -0.08000000000000007,
        "cone_half_angle_deg": 0.716159945470406,
        "plug_base_diameter_mm": 8.92,
        "plug_length_mm": 8.0,
        "plug_tip_diameter_mm": 8.72,
        "socket_bottom_diameter_mm": 8.8,
        "socket_depth_mm": 8.0,
        "socket_entry_diameter_mm": 9.0,
        "target_diametral_interference_mm": -0.08
      },
      "module": {
        "actual_cad_entry_interference_mm": 0.0,
        "cone_half_angle_deg": 2.6025622024997968,
        "plug_base_diameter_mm": 6.1,
        "plug_length_mm": 2.0,
        "plug_tip_diameter_mm": 5.918181818181819,
        "socket_bottom_diameter_mm": 5.9,
        "socket_depth_mm": 2.2,
        "socket_entry_diameter_mm": 6.1,
        "target_diametral_interference_mm": 0.0
      },
      "split_joint": {
        "actual_cad_entry_interference_mm": -0.14000000000000057,
        "cone_half_angle_deg": 0.7161599454704102,
        "plug_base_diameter_mm": 8.86,
        "plug_length_mm": 11.8,
        "plug_tip_diameter_mm": 8.565,
        "socket_bottom_diameter_mm": 8.7,
        "socket_depth_mm": 12.0,
        "socket_entry_diameter_mm": 9.0,
        "target_diametral_interference_mm": -0.14
      }
    },
    "end_diametral_offset": {
      "unit": "mm",
      "value": -0.08
    },
    "end_plug_base_tip": {
      "unit": "mm",
      "values": [
        8.92,
        8.72
      ]
    },
    "module_diametral_offset": {
      "unit": "mm",
      "value": 0.0
    },
    "module_plug_base_tip": {
      "unit": "mm",
      "values": [
        6.1,
        5.918181818181819
      ]
    },
    "selected_wedge": "M",
    "selected_wedge_preload_offset": {
      "unit": "mm",
      "value": 0.0
    },
    "slider_guide_clearance_per_side": {
      "unit": "mm",
      "value": 0.2
    },
    "split_joint_diametral_offset": {
      "unit": "mm",
      "value": -0.14
    },
    "split_joint_key_slot": {
      "male_key_height": {
        "unit": "mm",
        "value": 1.0
      },
      "male_key_width": {
        "unit": "mm",
        "value": 0.8
      },
      "radial_center": {
        "unit": "mm",
        "value": 4.7
      },
      "radial_height": {
        "unit": "mm",
        "value": 1.6
      },
      "width": {
        "unit": "mm",
        "value": 1.0
      }
    },
    "split_joint_plug_base_tip": {
      "unit": "mm",
      "values": [
        8.86,
        8.565
      ]
    },
    "user_record": {
      "confirmation_date": "2026-08-14",
      "confirmation_time": null,
      "source_type": "user_confirmed_measurement_record"
    }
  },
  "device_id": "acoustic-ladder-v1-3-calibrated-printed-candidate",
  "device_version": "Acoustic Ladder V1.3 Calibrated Round Main Tube",
  "manufacturing": {
    "actual_print_setting": {
      "automatic_orientation_enabled": null,
      "bed_temperature_c": null,
      "bottom_layers": null,
      "brim_width_mm": null,
      "elephant_foot_compensation_mm": null,
      "first_layer_speed_mm_s": null,
      "flow_ratio": null,
      "infill_pattern": null,
      "infill_percent": null,
      "layer_height_mm": null,
      "line_width_mm": null,
      "nozzle_diameter_mm": null,
      "nozzle_temperature_c": null,
      "other_slicer_settings": null,
      "pressure_advance_or_flow_dynamics": null,
      "print_speed_mm_s": null,
      "seam_position": null,
      "support_settings": null,
      "top_layers": null,
      "wall_count": null
    },
    "build_plate": "Bambu Textured PEI Plate",
    "calibration_test_date": null,
    "design_recommendation": {
      "layer_height_range": {
        "unit": "mm",
        "values": [
          0.16,
          0.2
        ]
      },
      "material": "PLA/PLA+",
      "nozzle_diameter": {
        "unit": "mm",
        "value": 0.4
      },
      "wall_count": 5
    },
    "environment": {
      "humidity_percent": null,
      "temperature_c": null
    },
    "fit_cycle_counts": {
      "end_interface": null,
      "module_interface": null,
      "split_joint_interface": null
    },
    "material": {
      "batch": null,
      "brand": null,
      "color": null,
      "dried": null,
      "drying_duration_h": null,
      "drying_temperature_c": null,
      "model": null,
      "type": null
    },
    "measurement": {
      "tool": null,
      "tool_accuracy": null
    },
    "operator": null,
    "physical_print_confirmed": true,
    "post_processing": {
      "actual_material_removed": null,
      "deburring_tool": null,
      "permitted_principle": "minor_deburring_only",
      "sandpaper_specification": null
    },
    "print_date": null,
    "printer": {
      "brand": "Bambu Lab",
      "firmware_version": null,
      "model": null
    },
    "slicer": {